<?xml version="1.0" encoding="UTF-8"?>
<!DOCTYPE cancion SYSTEM "cancion.dtd">
<cancion duracion="4:47" anio="2008">
  <titulo>Give it 2 me</titulo>
  <compositores>
    <compositor>
        <nombre>Pharrell</nombre>
        <apellidos>Williams</apellidos>
    </compositor>  
  </compositores>
<productores>
    <productor>
        <nombre>Pharrell</nombre>  
        <apellidos>Williams</apellidos>  
    </productor>
</productores>
<sello>Warnes Bros</sello>
<artista>Madonna</artista>
</cancion>